{"clipped_cells":120,"encoding":{"compression":"gzip","decode":"slope_degC_per_decade = byte * 0.01 (byte === -128 means insufficient data)","dtype":"int8","file":"grid_trends_gistemp_2deg.i8.bin.gz","gz_bytes":24382,"layers":["slope","significant"],"layout":"C-order [layer][period][lat][lon]; layer 0 = slope, layer 1 = significant (1/0; 0 where slope is missing); period order = periods; rows north to south, columns west to east","missing_value":-128,"sha256_uncompressed":"90f8890c43013f454b8f3726d63e15ab5db885962bf04da7b083f71a0ede4f09","slope_scale_degC_per_decade_per_unit":0.01,"uncompressed_bytes":129600,"valid_range":[-127,127]},"grid":{"lat_first_center":89.0,"lat_step_deg":2.0,"lon_first_center":-179.0,"lon_step_deg":2.0,"n_lat":90,"n_lon":180},"id":"grid_trends_gistemp_2deg","periods":[{"end":2025,"id":"1880_latest","min_valid_years":117,"n_significant_cells":11957,"n_valid_cells":12674,"n_years":146,"start":1880},{"end":2025,"id":"1951_latest","min_valid_years":60,"n_significant_cells":13249,"n_valid_cells":15914,"n_years":75,"start":1951},{"end":2025,"id":"1975_latest","min_valid_years":41,"n_significant_cells":12730,"n_valid_cells":15914,"n_years":51,"start":1975},{"end":2025,"id":"1991_latest","min_valid_years":28,"n_significant_cells":10877,"n_valid_cells":16004,"n_years":35,"start":1991}],"product":"NASA GISTEMP v4 gistemp1200_GHCNv4_ERSSTv5","rule":"A cell needs at least 80% of the period's annual values (stored annual cell means, unquantized) to get a slope. The slope is the same OLS used for the global series (analytics.stats.ols_trend). significant = the AR(1)-adjusted 95% interval (effective sample size from the cell's residual lag-1 autocorrelation) excludes zero. Many cells are tested at once, so some significant cells are expected by chance; no multiple-testing correction is applied.","schema_version":"v1","source":"NASA GISTEMP v4","tags":{"clipped_cells":"DERIVED","encoding":"DERIVED","grid":"DERIVED","id":"DERIVED","periods":"DERIVED","product":"DERIVED","rule":"DERIVED","source":"DERIVED","units":"DERIVED"},"units":"degC_per_decade"}
