{"clipped_cells":0,"encoding":{"compression":"gzip","decode":"slope_degC_per_decade = byte * 0.01 (byte === -128 means insufficient data)","dtype":"int8","file":"grid_trends_hadcrut5_5deg.i8.bin.gz","gz_bytes":6319,"layers":["slope","significant"],"layout":"C-order [layer][period][lat][lon]; layer 0 = slope, layer 1 = significant (1/0; 0 where slope is missing); period order = periods; rows north to south, columns west to east","missing_value":-128,"sha256_uncompressed":"e9f1f742b947e9ec19aa3ed3afa3ee9020a42514c7c0a12606574e2c93c5afbf","slope_scale_degC_per_decade_per_unit":0.01,"uncompressed_bytes":20736,"valid_range":[-127,127]},"grid":{"lat_first_center":87.5,"lat_step_deg":5.0,"lon_first_center":-177.5,"lon_step_deg":5.0,"n_lat":36,"n_lon":72},"id":"grid_trends_hadcrut5_5deg","periods":[{"end":2025,"id":"1880_latest","min_valid_years":117,"n_significant_cells":1822,"n_valid_cells":1847,"n_years":146,"start":1880},{"end":2025,"id":"1951_latest","min_valid_years":60,"n_significant_cells":2321,"n_valid_cells":2441,"n_years":75,"start":1951},{"end":2025,"id":"1975_latest","min_valid_years":41,"n_significant_cells":2094,"n_valid_cells":2534,"n_years":51,"start":1975},{"end":2025,"id":"1991_latest","min_valid_years":28,"n_significant_cells":1858,"n_valid_cells":2539,"n_years":35,"start":1991}],"product":"HadCRUT5 5.2.0.0 analysis ensemble mean","rule":"A cell needs at least 80% of the period's annual values (stored annual cell means, unquantized) to get a slope. The slope is the same OLS used for the global series (analytics.stats.ols_trend). significant = the AR(1)-adjusted 95% interval (effective sample size from the cell's residual lag-1 autocorrelation) excludes zero. Many cells are tested at once, so some significant cells are expected by chance; no multiple-testing correction is applied.","schema_version":"v1","source":"HadCRUT5 5.2.0.0","tags":{"encoding":"DERIVED","grid":"DERIVED","periods":"DERIVED","rule":"DERIVED"},"units":"degC_per_decade"}
